Question,Option1,Option2,Option3,Option4
How do you handle tough conversations?,Face it head-on,Call them,Write it out,Use humor & emojis
What’s your preferred way to communicate?,Talking in person,Phone calls,Texting,Memes & emojis
How dramatic do you want this breakup to be?,No drama at all,A little dramatic,Full-on drama,Hilarious exit
How comfortable are you with confrontation?,Very,Somewhat,Not really,Avoid it at all costs
What’s your ideal breakup method?,Honest chat,Quick call,Text message,Confusing but funny emoji drop
